### ISSUE TITLE
Engine seems broken on macOS Sierra

### ISSUE THREAD

**Issue by daniviga** [gem/oq-engine#2595]
The OQ Engine remains stuck waiting for a reply from the DbServer

```bash
(openquake) Users-MacBook-Pro:~ user$ oq engine
WARNING:root:DB server started with /Users/user/openquake/bin/python, listening on 127.0.0.1:1908...
```

the DbServer actually gets the command and execute the command but no result is sent back to the Engine

```bash
(openquake) Users-MacBook-Pro:~ user$ oq dbserver start
WARNING:root:DB server started with /Users/user/openquake/bin/python, listening on 127.0.0.1:1908...
Got ('get_dbpath',)
Done get_dbpath
```
while
```python
from openquake.commonlib import logs
logs.dbcmd('get_dbpath')
```

This is the last wireshark logged packet (excluding ACK)

```
Frame 19: 80 bytes on wire (640 bits), 80 bytes captured (640 bits) on interface 0
Null/Loopback
Internet Protocol Version 4, Src: 127.0.0.1, Dst: 127.0.0.1
Transmission Control Protocol, Src Port: 49324, Dst Port: 1908, Seq: 69, Ack: 69, Len: 24
    Source Port: 49324
    Destination Port: 1908
    [Stream index: 1]
    [TCP Segment Len: 24]
    Sequence number: 69    (relative sequence number)
    [Next sequence number: 93    (relative sequence number)]
    Acknowledgment number: 69    (relative ack number)
    Header Length: 32 bytes
    Flags: 0x018 (PSH, ACK)
    Window size value: 12757
    [Calculated window size: 408224]
    [Window size scaling factor: 32]
    Checksum: 0xfe40 [unverified]
    [Checksum Status: Unverified]
    Urgent pointer: 0
    Options: (12 bytes), No-Operation (NOP), No-Operation (NOP), Timestamps
    [SEQ/ACK analysis]
Data (24 bytes)
    Data: 000000148002550a6765745f64627061746871018571022e
    [Length: 24]
```
![screen shot 2017-02-28 at 5 56 53 am](https://cloud.githubusercontent.com/assets/1818657/23407894/d284651a-fd7a-11e6-8e12-c1038b70b23e.png)

Full log:
[engine-sierra.pcapng.zip](https://github.com/gem/oq-engine/files/806946/engine-sierra.pcapng.zip)

Reported by @raoanirudh
